"product id","Part Number",Description
69203,20AD027A3AYNAEG0,"The 20AD027A3AYNAEG0 manufactured by Allen Bradley has a rating of 15 kilowatt. It comes with a panel mount - IP 20 enclosure rating. It is a 27 Amp rated drive and is a size D frame unit. It is a 480V AC VFD. It is a 20 horsepower drive. "
69277,20AD027A3AYNAEN0,"The Allen-Bradley/Rockwell Automation 20AD027A3AYNAEN0 PF70 comes with a ND output rating of 20 HP. This PF70 has a kW ND output rating of 15 kW. Additionally, this PF70 is a 27 A VFD. It has an Ethernet communcation (20-COMM-E) board. In addition, this adjustable frequency drive needs 480V AC and is housed in a panel mount - IP 20 enclosure type. "
69276,20AD027A3AYNAENN,"This Allen-Bradley 27 Amp PF70 is a 15 kW rated unit. This PowerFlex 70 AC drive is housed in a panel mount (IP20) enclosure and has a full numeric LCD inferface module installed on this drive. This drive comes with a standard board installed. It is a 20 HP rated drive. It has power requirements of 480 VAC 3 phase. "
69440,20AD027A3AYNANC0,"The Allen Bradley 20AD027A3AYNANC0 AC drive has an amperage output rating of 27 Amp. This PowerFlex 70 AC drive comes with an enhanced unit. This drive comes with a HP ND output rating of 20 horsepower. Additionally, it is a 15 kilowatt rated drive. Also, it is housed in an IP20 (panel mount) enclosure type, has a D frame size, and is powered by 480V AC. "
69756,20AD027A3AYNANC1,"This Allen-Bradley/Rockwell Automation 15 kW drive is a 20 HP rated unit. It is a 27 A drive and is contained in a panel mount - IP 20 enclosure type. Additionally, it has power requirements of 480 VAC (50 Hz). In addition, it comes with a D frame size. It comes with an encoder (5V/12V) module installed. "
69459,20AD027A3AYNANCN,"This PowerFlex 70 made by AB is a 27 A rated unit. This AC drive also, is powered by 480V AC. It has a keypad LCD (20-HIM-A3) HIM unit included. This AC drive is a size D frame. Additionally, it comes with a kW ND output rating of 15 kilowatt, a HP ND output rating of 20 HP, and is housed in an IP20 (panel mount) enclosure. "
69458,20AD027A3AYNANG0,"The Allen Bradley 20AD027A3AYNANG0 AC drive is a 27 A rated VFD. This adjustable frequency drive also, is a 15 kilowatt VFD. This PowerFlex 70 AC drive has power requirements of 480V AC. It comes with a safe-off unit and a D frame size. In addition, it is a 20 HP rated unit. "
69764,20AD027A3AYNANG1,"The Allen-Bradley/Rockwell Automation 20AD027A3AYNANG1 VFD comes with a rating of 27 Amp. In addition, it comes with a D frame size and a panel mount (IP20). Also, it is a 20 HP rated unit. It has power requirements of 480V AC. This PF70 is a 15 kW unit. "
69457,20AD027A3AYNANN0,"This AB AC drive comes with an output rating of 27 Amp. This VFD has a keypad LCD (20-HIM-A3) included on the faceplate. Also, it is a 20 horsepower unit. It has power requirements of 480 VAC 3 phase. In addition, it has a rating of 15 kilowatt, is housed in a panel mount (IP20) enclosure, and a standard control card included. "
69787,20AD027A3AYNANNN,"The 20AD027A3AYNANNN by AB is a 27 A AC drive. Additionally, this Allen-Bradley PF70 comes with a kW rating of 15 kW. In addition, this AB PowerFlex 70 AC drive is powered with 480V AC. It comes with a horsepower rating of 20 horsepower. This AC drive comes with a full numeric LCD installed on this drive and is a size D frame. "
71658,20AD027A3AYYACNN,"This Allen-Bradley/Rockwell Automation PF70 comes with a ND output rating of 15 kilowatt. Additionally, this Allen Bradley AC drive comes with a standard card installed. This PF70 has a resistor. It has an amperage rating of 27 Amp and is enabled for communication by having a ControlNet communication(20-COMM-C) module. This drive in addition, is a 20 horsepower rated drive. "
69635,20AD027A3AYYANC0,"The Allen Bradley 20AD027A3AYYANC0 VFD is a 15 kW VFD. Also, this Allen-Bradley PowerFlex 70 AC drive comes with a panel mount - IP 20 enclosure. It is a 20 horsepower rated unit and is a 27 A rated AC drive. This PF70 additionally, has a D frame size. It comes with an enhanced unit on the drive. "
69471,20AD027A3AYYANNN,"The Allen Bradley 20AD027A3AYYANNN PowerFlex 70 AC drive comes with a horsepower rating of 20 horsepower. Also, this Allen Bradley AC drive has power requirements of 480V AC. It comes with a kW ND output rating of 15 kilowatt. Additionally, it comes with an amperage rating of 27 Amp. This PF70 comes with a D frame size and an IP20 (panel mount) enclosure type rating. "
69275,20AD027A3NYNACC0,"The 20AD027A3NYNACC0 made by AB is a 27 Amp rated unit. This AC drive has a full numeric LCD human interface module installed on the faceplate. This adjustable frequency drive utilizes 480V AC. This AC drive is a 15 kilowatt drive. In addition, this drive is a 20 horsepower rated drive and is contained in a panel mount - IP 20 enclosure type. "
69274,20AD027A3NYNACCN,"This Allen Bradley 27 A adjustable frequency drive comes with a ND output rating of 20 horsepower. It requires 480 VAC 3 phase power. Additionally, this AC drive has an enhanced card included on the drive. This PowerFlex 70 AC drive is a size D frame unit. Also, it comes with a rating of 15 kW and a full numeric LCD inferface module included on this drive. "
69273,20AD027A3NYNACN0,"The 20AD027A3NYNACN0 manufactured by AB is a 15 kW rated drive. It has a ControlNet module installed. This PowerFlex 70 AC drive additionally, has an IP20 (panel mount) enclosure type rating. This AC drive has power requirements of 480 VAC 3 phase. In addition, this adjustable frequency drive comes with an output rating of 27 A and is a 20 horsepower unit. "
69272,20AD027A3NYNACNN,"This drive manufactured by Allen-Bradley is a 15 kW rated unit. Additionally, it is a 27 Amp rated drive and has a keypad LCD (20-HIM-A3) HIM unit included on the cover. In addition, this Allen-Bradley/Rockwell Automation PowerFlex 70 AC drive utilizes 480 VAC 3 phase power. This PF70 is a size D frame drive. This VFD is a 20 HP rated drive. "
69271,20AD027A3NYNADC0,"This AB adjustable frequency drive has a ND output rating of 15 kW. This adjustable frequency drive allows for communication with a DeviceNet (20-COMM-D) unit installed. Additionally, it comes with a HP ND output rating of 20 horsepower, is a 27 Amp unit, and is housed in a panel mount (IP20) enclosure type. In addition, this drive is a size D frame drive. This PowerFlex 70 is a 480 VAC 3 phase VFD. "
69270,20AD027A3NYNADCN,"This PowerFlex 70 AC drive built by Allen Bradley has an amperage output rating of 27 A. This adjustable frequency drive comes with a DeviceNet (20-COMM-D) option board. Also, this PF70 comes with a rating of 15 kW and is housed in an IP20 (panel mount) enclosure. This drive additionally, is a 20 horsepower drive. This AC drive has an enhanced option board included on the drive. "
69269,20AD027A3NYNADN0,"This PowerFlex 70 manufactured by Allen-Bradley/Rockwell Automation comes with a ND output rating of 15 kW. It has an amperage rating of 27 Amp and is a 20 horsepower rated drive. This PF70 has an IP20 (panel mount) enclosure. Also, it is a 480 VAC 3 phase variable frequency drive. In addition, this Allen Bradley adjustable frequency drive is a size D frame. "
69268,20AD027A3NYNADNN,"The Allen-Bradley/Rockwell Automation 20AD027A3NYNADNN AC drive is a 15 kilowatt rated VFD. Additionally, this PF70 has a D frame size. This AC drive allows for communication by having a DeviceNet (20-COMM-D) unit, is housed in an IP20 (panel mount) enclosure type, and has a standard control module. It is a 20 horsepower rated drive. It is a 27 Amp drive. "
69267,20AD027A3NYNAEC0,"The 20AD027A3NYNAEC0 made by Allen-Bradley/Rockwell Automation is a 15 kilowatt rated drive. In addition, it is a 20 horsepower rated drive, is a 27 A rated unit, and comes with an Ethernet board. Additionally, this adjustable frequency drive comes with a full numeric LCD included on the cover. It is a size D frame unit. This PowerFlex 70 has power requirements of 480V AC. "
69266,20AD027A3NYNAECN,"This AC drive by AB is a 15 kilowatt rated drive. This adjustable frequency drive comes with a HP rating of 20 horsepower, an amperage output rating of 27 A, and is a 480 VAC 3 phase drive. This PowerFlex 70 AC drive comes with a D frame size. In addition, this Allen-Bradley VFD has an Ethernet option installed. This PowerFlex 70 also, has a panel mount - IP 20 enclosure rating. "
69265,20AD027A3NYNAEN0,"The Allen-Bradley/Rockwell Automation 20AD027A3NYNAEN0 PowerFlex 70 has a rating of 15 kilowatt. Also, this Allen-Bradley/Rockwell Automation PowerFlex 70 AC drive has a HP ND output rating of 20 horsepower. This PowerFlex 70 is a 27 A VFD and comes with a full numeric LCD on the cover. Additionally, it has power requirements of 480 VAC (50 Hz). This VFD has an Ethernet module included. "
69264,20AD027A3NYNAENN,"This VFD built by Allen-Bradley is a 15 kilowatt unit. Additionally, it has a rating of 20 HP and is a 480 VAC 3 phase VFD. It has a LCD and numeric keypad inferface module included on this drive. This PowerFlex 70 AC drive has an amperage output rating of 27 Amp. Also, this VFD allows for communication by having an Ethernet communcation (20-COMM-E) module. "
69263,20AD027A3NYNANC0,"This Allen Bradley 15 kW PF70 has an output rating of 27 Amp. It has power requirements of 480 VAC (50 Hz) and comes with an enhanced control unit on the drive. This VFD also, is a size D frame drive. Additionally, this PowerFlex 70 has a HP ND output rating of 20 horsepower. This PowerFlex 70 AC drive is contained in a panel mount (IP20) enclosure. "
69262,20AD027A3NYNANCN,"This Allen-Bradley drive has a HP ND output rating of 20 horsepower. This PowerFlex 70 also, has a rating of 27 A. This adjustable frequency drive has a D frame size, needs 480V AC power, and is contained in a panel mount - IP 20 enclosure type. It is a 15 kilowatt VFD. It has an enhanced module included on the drive. "
69261,20AD027A3NYNANN0,"This VFD built by Allen Bradley comes with an output rating of 27 Amp. It has a keypad LCD (20-HIM-A3) installed on the faceplate. This PF70 additionally, comes with a kW ND output rating of 15 kW. This AC drive is contained in a panel mount (IP20) enclosure. Also, this PowerFlex 70 AC drive is a 20 HP drive and has power requirements of 480V AC. "
69260,20AD027A3NYNANNN,"The Allen-Bradley 20AD027A3NYNANNN PF70 has a kW ND output rating of 15 kW. It is a size D frame. It is a 480 VAC (50 Hz) drive. Additionally, this PowerFlex 70 AC drive comes with an output rating of 27 A and a standard control unit. In addition, this PowerFlex 70 is a 20 horsepower drive. "
71618,20AD027C0AYNANC0,"This AB 15 kW PowerFlex 70 AC drive is a 20 horsepower rated unit. In addition, this drive is housed in a wall/machine mount = IP66 enclosure type and is a size D frame unit. Additionally, this PowerFlex 70 AC drive comes with a rating of 27 A. It has an enhanced control option board included. This drive has power requirements of 480 VAC 3 phase. "
69136,20AD027C3AYNANC0,"This PowerFlex 70 AC drive made by Allen Bradley is a 27 A rated drive. Also, it is a 20 horsepower rated drive, requires 480 VAC (50 Hz) to operate, and has a wall/machine mount (IP66) enclosure. Additionally, this AC drive has a D frame size. This VFD has a full numeric LCD human interface module installed on this drive. It is a 15 kilowatt unit. "
69942,20AD027C3AYNANNN,"This AB adjustable frequency drive has an output rating of 27 A. Also, it has a keypad LCD (20-HIM-A3) HIM unit on this drive. It is a size D frame. In addition, it is a 15 kilowatt rated VFD. It is a 20 HP rated unit and comes with a standard control board installed on the drive. "
69135,20AD027F0AYNANC0,"The 20AD027F0AYNANC0 manufactured by Allen-Bradley is a 27 A AC drive. Additionally, this VFD has an enhanced option on the drive. This VFD is powered with 480 VAC 3 phase. It has no keypad unit, instead the drive a blank cover. In addition, it has a rating of 15 kW and is a 20 HP rated drive. "
69209,20AD027F0AYNNN,"The Allen-Bradley/Rockwell Automation 20AD027F0AYNNN PowerFlex 70 AC drive has a ND output rating of 15 kilowatt. This adjustable frequency drive additionally, is contained in a flange mount - front chassis (IP66) enclosure. This PF70 is a 27 Amp AC drive, comes with a HP ND output rating of 20 HP, and is a 480V AC VFD. It is a size D frame drive. In addition, it has a blank cover instead of the HIM module. "
69469,20AD027M0AYNANC0,"This PowerFlex 70 made by Allen Bradley is a 27 Amp unit. This PowerFlex 70 comes with no HIM unit, instead it a blank cover. This PF70 is a 15 kilowatt rated drive and is a 480 VAC 3 phase drive. Additionally, this Allen Bradley adjustable frequency drive comes with a D frame size. In addition, it is a 20 horsepower unit. "
69571,20AD034A0AYNACC0,"The Allen-Bradley/Rockwell Automation 20AD034A0AYNACC0 AC drive has an output rating of 34 Amp. Additionally, this Allen-Bradley drive has a HP rating of 25 HP. It has a ControlNet (Coax) card installed. This PowerFlex 70 has a kW rating of 18.5 kilowatt and a blank cover in place of the keypad module. In addition, it comes with a panel mount - IP 20 enclosure. "
69570,20AD034A0AYNACCN,"This AC drive built by Allen-Bradley/Rockwell Automation comes with a rating of 25 horsepower. Also, it is a 18.5 kW rated VFD and comes with an amperage output rating of 34 Amp. In addition, this AB VFD is enabled for communication with a ControlNet module. It needs 480 VAC (50 Hz) power to operate. It comes with an IP20 (panel mount) rating. "
69569,20AD034A0AYNACN0,"The 20AD034A0AYNACN0 made by Allen-Bradley comes with a kW rating of 18.5 kilowatt. This PowerFlex 70 AC drive comes with a panel mount (IP20) enclosure rating. This PowerFlex 70 has an output rating of 34 Amp. Also, this Allen-Bradley PF70 has a blank cover instead of the keypad/LCD module. In addition, this drive has a HP rating of 25 HP and a D frame size. "
71527,20AD034A0AYNACNN,"This PowerFlex 70 AC drive by AB comes with an amperage output rating of 34 A. In addition, this AB PowerFlex 70 AC drive has a HP ND output rating of 25 HP. This PF70 comes with a D frame size. It has a kW ND output rating of 18.5 kilowatt. Also, this PowerFlex 70 comes with no human interface installed, instead it a blank cover and has power requirements of 480 VAC (50 Hz). "
69568,20AD034A0AYNADC0,"This Allen-Bradley/Rockwell Automation 25 horsepower drive is a 34 A AC drive. This PowerFlex 70 is a size D frame drive, comes with a DeviceNet communication (20-COMM-D) card, and is powered by 480 VAC (50 Hz). Also, this AB adjustable frequency drive comes with a panel mount - IP 20 enclosure. Additionally, it is a 18.5 kW rated VFD. It comes with no human interface included, instead this drive a blank cover. "
69567,20AD034A0AYNADN0,"The Allen-Bradley 20AD034A0AYNADN0 AC drive comes with an amperage output rating of 34 Amp. Also, this Allen-Bradley/Rockwell Automation drive comes with a kW rating of 18.5 kW. Additionally, it has no HIM unit installed, instead the drive a blank cover and an IP20 (panel mount) enclosure rating. This PowerFlex 70 has power requirements of 480 VAC (50 Hz). This PF70 comes with a rating of 25 horsepower. "
69566,20AD034A0AYNADNN,"This PowerFlex 70 AC drive built by Allen Bradley comes with a ND output rating of 18.5 kilowatt. This PF70 is powered by 480V AC. Also, it has an amperage rating of 34 A and a HP rating of 25 HP. Additionally, this PowerFlex 70 is a size D frame. It is housed in an IP20 (panel mount) enclosure. "
69565,20AD034A0AYNAEC0,"This AC drive by Allen-Bradley/Rockwell Automation is a 18.5 kilowatt VFD. This VFD comes with an enhanced option board. This AC drive has power requirements of 480 VAC (50 Hz). Also, it is a 25 HP rated drive, comes with an amperage rating of 34 Amp, and is housed in a panel mount (IP20) enclosure. In addition, this Allen-Bradley adjustable frequency drive is a size D frame drive. "
69564,20AD034A0AYNAECN,"This Allen-Bradley 25 horsepower drive is a 34 Amp unit. Additionally, this Allen-Bradley/Rockwell Automation VFD comes with a kW rating of 18.5 kilowatt. In addition, it has an enhanced option on the drive. This PowerFlex 70 requires 480 VAC (50 Hz), comes with a D frame size, and a panel mount - IP 20 rating. It comes with a blank cover instead of the HIM module. "
69563,20AD034A0AYNAEN0,"The 20AD034A0AYNAEN0 made by Allen-Bradley is a 25 horsepower rated unit. This drive is a size D frame. Also, it has a standard option included and requires 480 VAC 3 phase power. This PF70 has an amperage rating of 34 Amp. This drive in addition, is a 18.5 kW unit. "
69562,20AD034A0AYNAENN,"The Allen-Bradley/Rockwell Automation 20AD034A0AYNAENN VFD comes with an output rating of 34 Amp. It is housed in an IP20 (panel mount) enclosure type and is a 480V AC variable frequency drive. In addition, this Allen-Bradley drive is enabled for communication with an EtherNet/IP module. Additionally, this Allen-Bradley PowerFlex 70 has a kW rating of 18.5 kW. It has a HP rating of 25 horsepower. "
69133,20AD034A0AYNANC0,"The 20AD034A0AYNANC0 made by Allen Bradley has a horsepower ND output rating of 25 horsepower. It has no keypad unit, instead the drive a blank cover. It is a 18.5 kW rated unit and utilizes 480V AC power to operate. This VFD additionally, has an enhanced control card included. Also, it is a 34 Amp rated drive. "
71535,20AD034A0AYNANG0,"The 20AD034A0AYNANG0 made by Allen-Bradley is a 34 Amp rated drive. This PowerFlex 70 also, has a blank cover in place of the interface module. Additionally, this AC drive comes with an enhanced control card installed. This PF70 has power requirements of 480V AC. It is a 25 horsepower rated drive and has a kW rating of 18.5 kilowatt. "
69561,20AD034A0AYNANN0,"This Allen Bradley PF70 comes with a HP ND output rating of 25 horsepower. Additionally, it is a 18.5 kilowatt drive and comes with an amperage rating of 34 Amp. This PF70 has a standard control module included. It has a blank cover instead of the interface module. This PF70 in addition, is a size D frame unit. "
69560,20AD034A0AYNANNN,"This Allen-Bradley/Rockwell Automation PowerFlex 70 AC drive is a 18.5 kW rated drive. Also, it is a 25 HP unit, comes with a rating of 34 Amp, and is powered with 480V AC. In addition, this Allen Bradley VFD has a D frame size. This PowerFlex 70 AC drive comes with no keypad unit included, instead the drive a blank cover. This drive comes with an IP20 (panel mount) enclosure type rating. "
71551,20AD034A0AYYANC0,"This Allen-Bradley/Rockwell Automation 18.5 kilowatt adjustable frequency drive is a 34 Amp rated VFD. This PowerFlex 70 is a size D frame drive. This PowerFlex 70 AC drive comes with an IP20 (panel mount) enclosure type. This PF70 in addition, comes with a HP rating of 25 HP. Also, it has a brake Resistor installed and an enhanced control option board installed on the drive. "
69559,20AD034A0NYNACC0,"The Allen Bradley 20AD034A0NYNACC0 adjustable frequency drive has a kW ND output rating of 18.5 kilowatt. Also, this AC drive has a rating of 34 Amp. This PowerFlex 70 AC drive has a blank cover instead of the HIM. In addition, this PowerFlex 70 AC drive has a horsepower ND output rating of 25 horsepower and a ControlNet communication(20-COMM-C) unit included. It is contained in a panel mount (IP20) enclosure type. "
69558,20AD034A0NYNACN0,"This drive manufactured by AB has a kW rating of 18.5 kW. This drive has a rating of 34 Amp, a ControlNet option, and is a size D frame drive. It is a 480 VAC 3 phase VFD. This drive has a panel mount - IP 20 enclosure type rating. Additionally, it has a rating of 25 horsepower. "
69557,20AD034A0NYNACNN,"The 20AD034A0NYNACNN by AB has a kW rating of 18.5 kW. Additionally, it comes with a ND output rating of 25 horsepower. It allows for communication with a ControlNet communication(20-COMM-C) module. In addition, this Allen-Bradley AC drive has power requirements of 480 VAC (50 Hz). It is a 34 Amp rated unit and has a blank cover in place of the keypad/LCD module. "
69556,20AD034A0NYNADC0,"This Allen-Bradley/Rockwell Automation 25 horsepower adjustable frequency drive comes with a rating of 34 Amp. Additionally, this adjustable frequency drive has a rating of 18.5 kilowatt. This adjustable frequency drive allows for communication with a DeviceNet unit. This VFD comes with no HIM unit installed, instead it a blank cover. This VFD also, is a 480 VAC (50 Hz) variable frequency drive. "
69555,20AD034A0NYNADCN,"This AC drive built by AB comes with an amperage output rating of 34 A. This adjustable frequency drive has a DeviceNet board, power requirements of 480V AC, and is a size D frame drive. This PowerFlex 70 is a 25 HP rated drive. It has no HIM, instead this drive a blank cover. This AC drive additionally, is a 18.5 kW VFD. "
69554,20AD034A0NYNADN0,"The Allen-Bradley/Rockwell Automation 20AD034A0NYNADN0 PowerFlex 70 is a 18.5 kilowatt unit. Also, this Allen-Bradley PowerFlex 70 comes with a HP ND output rating of 25 horsepower. It has a blank cover in place of the keypad module and power requirements of 480 VAC 3 phase. This PowerFlex 70 AC drive is a 34 A rated drive. In addition, this Allen-Bradley/Rockwell Automation PowerFlex 70 AC drive comes with a DeviceNet (20-COMM-D) option board installed. "
69553,20AD034A0NYNADNN,"This adjustable frequency drive made by AB is a 25 horsepower rated drive. It comes with an amperage rating of 34 Amp. This PowerFlex 70 AC drive comes with a kW ND output rating of 18.5 kilowatt. Also, this PF70 has a panel mount (IP20) enclosure type. This drive is enabled for communication with a DeviceNet (20-COMM-D) module included, has power requirements of 480 VAC 3 phase, and a standard control module included. "
69552,20AD034A0NYNAEC0,"The Allen Bradley 20AD034A0NYNAEC0 PowerFlex 70 AC drive comes with a rating of 18.5 kW. Additionally, it allows for communication by having an EtherNet/IP module and comes with an enhanced option board. It is a 34 A rated VFD. This VFD has a panel mount (IP20) enclosure rating. This adjustable frequency drive also, comes with a HP rating of 25 horsepower. "
69551,20AD034A0NYNAECN,"The 20AD034A0NYNAECN by Allen Bradley is a 25 horsepower rated unit. This AC drive has an amperage rating of 34 Amp and is a 18.5 kW rated drive. Additionally, this AB VFD allows for communication with an Ethernet communcation (20-COMM-E) module included. In addition, this adjustable frequency drive has a D frame size. This PF70 comes with an IP20 (panel mount) enclosure type rating. "
69550,20AD034A0NYNAEN0,"The AB 20AD034A0NYNAEN0 AC drive is a 18.5 kilowatt drive. This drive also, has an IP20 (panel mount). This PowerFlex 70 AC drive comes with no HIM unit installed, instead it a blank cover. This VFD is a 480V AC VFD. Additionally, it is a 25 HP rated unit and is a 34 Amp rated drive. "
69549,20AD034A0NYNAENN,"The Allen Bradley 20AD034A0NYNAENN PF70 has a kW ND output rating of 18.5 kW. This PowerFlex 70 in addition, comes with no keypad unit installed, instead this drive a blank cover. This adjustable frequency drive has an amperage output rating of 34 Amp and power requirements of 480 VAC 3 phase. This PF70 also, has a standard control board included on the drive. It is a 25 horsepower rated unit. "
69548,20AD034A0NYNANC0,"The Allen-Bradley/Rockwell Automation 20AD034A0NYNANC0 drive has a HP rating of 25 HP. Additionally, this VFD has an enhanced control module installed. In addition, it has a panel mount (IP20) enclosure rating. This adjustable frequency drive is a 18.5 kW rated unit. It comes with an amperage output rating of 34 Amp and is a size D frame drive. "
69547,20AD034A0NYNANCN,"The 20AD034A0NYNANCN by AB is a 18.5 kW unit. This VFD has power requirements of 480V AC. Additionally, this PowerFlex 70 AC drive has a ND output rating of 25 HP and no HIM included, instead it a blank cover. This PF70 comes with an enhanced control card included on the drive. Also, it comes with an amperage rating of 34 A. "
69546,20AD034A0NYNANN0,"This Allen-Bradley 25 horsepower PF70 is a 34 A AC drive. It has a D frame size. In addition, it comes with no human interface, instead this drive a blank cover. This VFD comes with a standard option, a panel mount (IP20), and is powered by 480 VAC (50 Hz). It is a 18.5 kilowatt drive. "
69545,20AD034A0NYNANNN,"The 20AD034A0NYNANNN made by Allen Bradley comes with a HP ND output rating of 25 HP. This adjustable frequency drive is a 18.5 kW rated drive and comes with a D frame size. In addition, it is powered with 480V AC. It has a blank cover in place of the keypad module. This PowerFlex 70 AC drive also, is a 34 Amp rated VFD. "
69697,20AD034A3AYNACC0,"The Allen Bradley 20AD034A3AYNACC0 PF70 is a 18.5 kilowatt rated unit. It has a D frame size. Also, this PowerFlex 70 AC drive is a 480 VAC 3 phase VFD. This PowerFlex 70 AC drive is a 34 A rated unit and comes with a horsepower rating of 25 HP. Additionally, this drive allows for communication with a ControlNet module. "
69544,20AD034A3AYNACCN,"This VFD manufactured by AB has a rating of 18.5 kW. This PF70 comes with a full numeric LCD inferface module included. Also, this PowerFlex 70 has a rating of 25 HP. This drive is housed in a panel mount - IP 20 enclosure type, is a size D frame, and has power requirements of 480 VAC 3 phase. This AC drive in addition, is a 34 Amp AC drive. "
71533,20AD034A3AYNACG0,"The Allen-Bradley/Rockwell Automation 20AD034A3AYNACG0 adjustable frequency drive comes with a HP rating of 25 horsepower. In addition, it comes with a D frame size. This drive comes with a rating of 18.5 kW and is a 34 A rated drive. This PowerFlex 70 AC drive has a ControlNet (Coax) card installed. This VFD is contained in a panel mount - IP 20 enclosure. "
