"product id","Part Number",Description
69970,20AC072A3NYNADN0,"This Allen-Bradley/Rockwell Automation 72 Amp adjustable frequency drive is a 50 horsepower drive. It comes with an IP20 (panel mount) enclosure type rating. In addition, it comes with a full numeric LCD on the faceplate. It comes with a DeviceNet board included and an E frame size. This PowerFlex 70 AC drive is a 37 kW rated VFD. "
69969,20AC072A3NYNAEC0,"This Allen Bradley 72 A PowerFlex 70 is a 37 kW unit. This VFD is a 400V AC drive. This PowerFlex 70 also, has an Ethernet communcation (20-COMM-E) option board installed. It is a 50 HP drive and comes with an IP20 (panel mount). Additionally, it comes with a keypad LCD (20-HIM-A3) HIM unit on this drive. "
69968,20AC072A3NYNAEN0,"This Allen-Bradley 37 kilowatt VFD comes with a rating of 50 horsepower. This PowerFlex 70 additionally, is enabled for communication with an Ethernet communcation (20-COMM-E) module. This PowerFlex 70 is housed in a panel mount (IP20) enclosure. This VFD also, is a 72 Amp drive. It comes with an E frame size. "
69967,20AC072A3NYNANC0,"This Allen-Bradley PF70 comes with a ND output rating of 37 kilowatt. In addition, this Allen-Bradley AC drive has a panel mount - IP 20 rating. This VFD is a 72 Amp rated unit and comes with an enhanced unit installed on the drive. This VFD also, is a 50 horsepower rated drive. It comes with an E frame size. "
69966,20AC072A3NYNANN0,"This Allen Bradley AC drive is a 37 kilowatt unit. It is housed in a panel mount - IP 20 enclosure type. It is a 72 Amp rated unit. It is a 50 HP rated unit. It is a size E frame and has power requirements of 400 VAC 3 phase. "
70142,20AC072C3AYNANC0,"The Allen-Bradley 20AC072C3AYNANC0 drive comes with a kW ND output rating of 37 kilowatt. It is a size E frame. It comes with a HP rating of 50 HP. Also, it is a 72 Amp rated drive. Additionally, it is a 400 VAC 3 phase VFD and is contained in an IP66 enclosure. "
70141,20AC072M3AYNANC0,"This AB 50 HP PF70 has a kW rating of 37 kilowatt. This PowerFlex 70 is a size E frame drive and has a keypad LCD (20-HIM-A3) inferface module on this drive. It is powered with 400V AC. Also, this AC drive has an enhanced card installed. In addition, this PowerFlex 70 AC drive comes with an amperage rating of 72 A. "
70140,20AC1P3A0AYNANC0,"This PowerFlex 70 by Allen-Bradley/Rockwell Automation is a 0.5 HP rated unit. This drive is a size A frame drive. In addition, it is a 0.37 kW rated unit, comes with an output rating of 1.3 Amp, and has power requirements of 400 VAC (50 Hz). This PowerFlex 70 AC drive has no HIM included, instead it a blank cover. Also, it has an enhanced control unit. "
70088,20AC1P3A0AYNANNN,"The 20AC1P3A0AYNANNN built by Allen-Bradley is a 0.37 kW drive. It is a 0.5 horsepower rated unit. It comes with a standard card installed. Additionally, it is a 400 VAC (50 Hz) variable frequency drive and has no HIM installed, instead this drive a blank cover. Also, it has an amperage output rating of 1.3 Amp. "
70089,20AC1P3A0AYNNNC0,"The 20AC1P3A0AYNNNC0 by AB comes with a rating of 1.3 A. It is powered with 400 VAC 3 phase. Additionally, it is a 0.5 HP rated drive, comes with a blank cover instead of the keypad module, and an A frame size. This PowerFlex 70 is housed in an IP20 (panel mount) enclosure type. Also, it is a 0.37 kW unit. "
70139,20AC1P3A2AYNNNNN,"This AB 0.37 kW PowerFlex 70 AC drive is a 0.5 HP rated unit. In addition, it has an output rating of 1.3 A. Also, this AB adjustable frequency drive comes with a panel mount (IP20) enclosure. It has a standard card on the drive. This adjustable frequency drive is a size A frame drive and is a 400V AC variable frequency drive. "
70138,20AC1P3A3AYNNEC0,"This AB PF70 is a 0.5 HP drive. In addition, this PF70 comes with an Ethernet communcation (20-COMM-E) board included. Also, this PowerFlex 70 has an A frame size. This AC drive comes with an amperage rating of 1.3 A, is a 0.37 kilowatt rated drive, and a LCD and numeric keypad HIM unit included on the faceplate. This PowerFlex 70 is powered by 400 VAC 3 phase. "
70092,20AC1P3C3AYNANC0,"The Allen-Bradley 20AC1P3C3AYNANC0 drive is a 0.37 kilowatt rated drive. It has an enhanced option on the drive. This VFD additionally, is a size A frame. It comes with an amperage rating of 1.3 A. In addition, it comes with a ND output rating of 0.5 horsepower, a LCD and numeric keypad HIM unit installed, and needs 400 VAC (50 Hz) to operate. "
70137,20AC2P1A0AYNANC0,"This AB 1 horsepower PF70 is a 2.1 A unit. It needs 400 VAC 3 phase power. This VFD comes with an A frame size and an enhanced control option installed on the drive. In addition, this VFD comes with no human interface included, instead this drive a blank cover. Also, this adjustable frequency drive comes with a kW rating of 0.75 kilowatt. "
70136,20AC2P1A0AYNANNN,"The Allen-Bradley 20AC2P1A0AYNANNN PF70 is a 2.1 A rated VFD. Also, it is a 1 horsepower unit. This adjustable frequency drive needs 400 VAC 3 phase to operate. Additionally, it is a 0.75 kilowatt drive and comes with an A frame size. This PF70 comes with a panel mount - IP 20 enclosure rating. "
70135,20AC2P1A0AYNNNC0,"This PF70 built by AB has an amperage rating of 2.1 Amp. This VFD is a 1 horsepower unit, is contained in an IP20 (panel mount) enclosure type, and comes with no HIM unit included, instead this drive a blank cover. It is a 400V AC variable frequency drive. Additionally, this PowerFlex 70 AC drive is a size A frame unit. In addition, it is a 0.75 kW drive. "
70091,20AC2P1A0AYNNNNN,"This Allen Bradley AC drive is a 1 horsepower drive. It is housed in a panel mount (IP20) enclosure type. This PowerFlex 70 AC drive in addition, is a 2.1 A AC drive. It is powered with 400 VAC 3 phase. Also, this Allen-Bradley/Rockwell Automation VFD comes with a rating of 0.75 kW. "
70134,20AC2P1A3AYNANNN,"The Allen Bradley 20AC2P1A3AYNANNN AC drive comes with an amperage rating of 2.1 Amp. It comes with a LCD and numeric keypad HIM unit installed on the faceplate. This AC drive has a standard control option board included on the drive. In addition, this drive is a 0.75 kilowatt drive and comes with a HP ND output rating of 1 HP. Additionally, this VFD is a 400 VAC (50 Hz) VFD. "
70133,20AC2P1A3AYNNEC0,"This PowerFlex 70 AC drive built by Allen-Bradley/Rockwell Automation is a 1 horsepower rated unit. This AC drive is a 0.75 kW VFD. This PowerFlex 70 AC drive is a size A frame unit. In addition, this adjustable frequency drive comes with an Ethernet communcation (20-COMM-E) option and has power requirements of 400V AC. This AC drive additionally, comes with an amperage output rating of 2.1 A. "
71632,20AC2P1A3AYYADC0,"The 20AC2P1A3AYYADC0 by Allen Bradley comes with a horsepower ND output rating of 1 HP. Also, this Allen-Bradley/Rockwell Automation PowerFlex 70 AC drive is a 0.75 kW VFD. This PowerFlex 70 AC drive has a full numeric LCD HIM unit installed on this drive. This AC drive additionally, comes with an amperage rating of 2.1 A. This adjustable frequency drive has power requirements of 400 VAC (50 Hz), a resistor, and a DeviceNet card included. "
70132,20AC2P1A4AYNNNNN,"This PowerFlex 70 manufactured by Allen-Bradley has a ND output rating of 1 HP. Additionally, this PowerFlex 70 comes with an amperage rating of 2.1 A and is a 0.75 kilowatt VFD. It has a panel mount (IP20) rating. This AC drive utilizes 400 VAC 3 phase. Also, it has an A frame size. "
70087,20AC2P1C3AYNANC0,"The Allen Bradley 20AC2P1C3AYNANC0 PowerFlex 70 AC drive has an output rating of 2.1 Amp. This VFD is a 1 HP rated unit, comes with a kW rating of 0.75 kW, and requires 400 VAC (50 Hz) power. Additionally, this Allen-Bradley AC drive comes with an A frame size. This adjustable frequency drive has a full numeric LCD included on the faceplate. Also, it comes with an enhanced option included on the drive. "
70131,20AC3P5A0AYNANC0,"This Allen-Bradley 3.5 Amp PowerFlex 70 AC drive is a 2 horsepower rated drive. Additionally, this AC drive is a 1.5 kilowatt rated drive. This PowerFlex 70 in addition, requires 400 VAC (50 Hz). It is housed in a panel mount - IP 20 enclosure. This PF70 comes with a blank cover in place of the keypad module. "
70090,20AC3P5A0AYNANNN,"The 20AC3P5A0AYNANNN made by Allen Bradley has a rating of 2 HP. This PF70 has an amperage output rating of 3.5 Amp. This PowerFlex 70 AC drive is a 1.5 kilowatt VFD. This VFD requires 400V AC power. Additionally, it has an A frame size and a blank cover in place of the interface module. "
70045,20AC3P5A0AYNNNC0,"The 20AC3P5A0AYNNNC0 manufactured by Allen Bradley is a 2 horsepower unit. This PowerFlex 70 has an IP20 (panel mount) rating. In addition, this Allen-Bradley/Rockwell Automation drive has an amperage rating of 3.5 A. This PowerFlex 70 has power requirements of 400 VAC (50 Hz) and a blank cover in place of the keypad/LCD module. This PF70 additionally, has a kW ND output rating of 1.5 kW. "
70106,20AC3P5A0AYNNNNN,"This Allen Bradley drive comes with an amperage output rating of 3.5 Amp. In addition, it is a 2 HP rated drive. It has an A frame size. This adjustable frequency drive also, is a 1.5 kilowatt rated drive. This drive has power requirements of 400 VAC 3 phase. "
70130,20AC3P5A3AYNANC0,"This PowerFlex 70 made by Allen Bradley has an output rating of 3.5 Amp. It has a HP rating of 2 horsepower. Also, it is a 400 VAC (50 Hz) VFD, comes with an A frame size, and is housed in a panel mount (IP20) enclosure. In addition, this Allen-Bradley/Rockwell Automation VFD comes with a rating of 1.5 kW. This AC drive has an enhanced control card installed. "
70129,20AC3P5A3AYNANNN,"This PowerFlex 70 AC drive manufactured by Allen-Bradley comes with an amperage output rating of 3.5 A. This PF70 comes with a standard card included. It is a size A frame unit. In addition, this PF70 has a ND output rating of 1.5 kW and is powered with 400 VAC (50 Hz). Also, this VFD comes with a ND output rating of 2 HP. "
70128,20AC3P5A3AYNNEC0,"This AB 1.5 kilowatt PF70 is a 3.5 A unit. This adjustable frequency drive has a LCD and numeric keypad human interface module included on this drive. This PF70 comes with an enhanced control unit on the drive. Additionally, it comes with an IP20 (panel mount) enclosure type and utilizes 400V AC power. In addition, it comes with a HP rating of 2 HP. "
71614,20AC3P5A3AYYADC0,"The 20AC3P5A3AYYADC0 manufactured by Allen-Bradley/Rockwell Automation has an amperage output rating of 3.5 Amp. In addition, it has a HP ND output rating of 2 horsepower and a keypad LCD (20-HIM-A3) installed on the cover. It has power requirements of 400 VAC 3 phase. It is a 1.5 kW rated VFD. Also, it has a brake Resistor installed. "
70127,20AC3P5A4AYNNNNN,"The Allen-Bradley 20AC3P5A4AYNNNNN adjustable frequency drive comes with an output rating of 3.5 Amp. This VFD comes with a kW ND output rating of 1.5 kW and a horsepower ND output rating of 2 horsepower. Additionally, it is a 400 VAC (50 Hz) VFD. This AC drive is housed in an IP20 (panel mount) enclosure. In addition, it is a size A frame. "
70126,20AC3P5A5AYNADNN,"The 20AC3P5A5AYNADNN by Allen Bradley comes with a ND output rating of 2 horsepower. Also, this Allen-Bradley adjustable frequency drive allows for communication by having a DeviceNet (20-COMM-D) module. It is a 3.5 Amp VFD and is a size A frame drive. In addition, this drive is housed in a panel mount - IP 20 enclosure type. This PowerFlex 70 AC drive has a rating of 1.5 kW. "
70125,20AC3P5C3AYNNNC0,"This Allen-Bradley 2 horsepower adjustable frequency drive has a rating of 1.5 kilowatt. Also, it is a 3.5 A rated unit, needs 400V AC power to operate, and has an IP66 enclosure type. This VFD has a LCD and numeric keypad human interface module. It comes with an enhanced option installed on the drive. Additionally, this Allen Bradley PowerFlex 70 AC drive is a size A frame. "
70124,20AC3P5C5AYNANC0,"This AB 1.5 kW PowerFlex 70 AC drive is a 2 HP rated drive. This VFD comes with an enhanced control unit and is a 400 VAC (50 Hz) drive. This drive also, has an A frame size. It is contained in a wall/machine mount = IP66 enclosure. This VFD in addition, is a 3.5 Amp unit. "
70046,20AC5P0A0AYNANC0,"This Allen Bradley PF70 is a 5 A rated drive. In addition, it is a 2.2 kW drive and comes with a ND output rating of 3 horsepower. This PF70 utilizes 400 VAC (50 Hz) power to operate. This drive is a size B frame. Additionally, it has a blank cover instead of the keypad/LCD module. "
70113,20AC5P0A0AYNANNN,"The 20AC5P0A0AYNANNN by Allen-Bradley comes with an amperage rating of 5 A. In addition, this AC drive is a size B frame unit. This drive is a 2.2 kW unit and is a 400 VAC (50 Hz) VFD. It comes with a horsepower rating of 3 HP. This PowerFlex 70 AC drive has no HIM, instead the drive a blank cover. "
70123,20AC5P0A0AYNNNNN,"The Allen-Bradley/Rockwell Automation 20AC5P0A0AYNNNNN PowerFlex 70 AC drive comes with a horsepower rating of 3 horsepower. In addition, this adjustable frequency drive is a size B frame unit and has power requirements of 400V AC. This AC drive is a 5 A VFD. It is housed in a panel mount (IP20) enclosure. This VFD is a 2.2 kilowatt rated VFD. "
70122,20AC5P0A1AYNNNNN,"This adjustable frequency drive made by AB has an amperage rating of 5 A. Additionally, this drive has power requirements of 400 VAC 3 phase. This adjustable frequency drive is a 3 horsepower unit. Also, this VFD comes with a ND output rating of 2.2 kW and is a size B frame. This AC drive comes with an IP20 (panel mount) enclosure rating. "
70109,20AC5P0A3AYNNNC0,"This Allen-Bradley/Rockwell Automation 2.2 kW VFD is a 5 A AC drive. Also, this PowerFlex 70 comes with a panel mount - IP 20 enclosure type. This PF70 has a horsepower rating of 3 horsepower and is a 400V AC VFD. This VFD has a keypad LCD (20-HIM-A3) on the cover. In addition, this PF70 has a B frame size. "
70114,20AC5P0F0AYNANC0,"The Allen-Bradley/Rockwell Automation 20AC5P0F0AYNANC0 adjustable frequency drive comes with a HP rating of 3 HP. This VFD additionally, is a size B frame unit. It comes with no human interface, instead this drive a blank cover. This VFD also, has an IP20 (flange mount). This PF70 is a 2.2 kW rated drive, is a 5 A rated VFD, and is a 400 VAC 3 phase VFD. "
69963,20AC8P7A0AYNANC0,"This Allen-Bradley PF70 comes with a ND output rating of 5 horsepower. Also, this PF70 comes with an enhanced module. This drive is contained in a panel mount (IP20) enclosure type. Additionally, it is a 4 kW rated VFD, has an amperage output rating of 8.7 A, and power requirements of 400 VAC (50 Hz). This AC drive has a B frame size. "
70121,20AC8P7A0AYNANNN,"The Allen-Bradley/Rockwell Automation 20AC8P7A0AYNANNN PowerFlex 70 AC drive has a ND output rating of 5 horsepower. It is a size B frame unit. Additionally, it has a rating of 8.7 A. This drive is a 400 VAC (50 Hz) VFD. This adjustable frequency drive also, has a ND output rating of 4 kW. "
70115,20AC8P7A0AYNARG0,"This AB VFD is a 4 kilowatt drive. Also, it allows for communication by having a remote I/O module. It has no keypad unit installed, instead this drive a blank cover. This PowerFlex 70 AC drive is a 5 HP rated drive and is contained in a panel mount - IP 20 enclosure. In addition, this Allen-Bradley AC drive is a 8.7 Amp VFD. "
69962,20AC8P7A0AYNNDNN,"This PowerFlex 70 AC drive by Allen-Bradley is a 4 kilowatt rated unit. In addition, this PowerFlex 70 AC drive is a 8.7 Amp unit. Additionally, it is a 5 horsepower rated unit, is powered with 400V AC, and has a DeviceNet unit included. This drive comes with a panel mount (IP20) enclosure type rating. This PowerFlex 70 AC drive comes with no HIM installed, instead this drive a blank cover. "
70164,20AC8P7A0AYNNNC0,"This AB PowerFlex 70 AC drive is a 5 HP unit. Additionally, this PF70 is contained in a panel mount (IP20) enclosure. It is powered by 400 VAC 3 phase. It has a rating of 4 kilowatt and is a 8.7 Amp rated unit. In addition, it comes with an enhanced module included. "
70120,20AC8P7A0AYYANC0,"This Allen Bradley 8.7 A drive is a 4 kilowatt rated drive. Additionally, it is a 5 HP rated drive. This PowerFlex 70 also, has no HIM unit included, instead the drive a blank cover. It requires 400V AC to operate. It is a size B frame unit. "
70108,20AC8P7A1AYNADNN,"This AB PF70 is a 5 horsepower rated unit. It has power requirements of 400 VAC (50 Hz). Also, this PowerFlex 70 AC drive comes with a panel mount (IP20) enclosure rating and is a size B frame drive. In addition, this PowerFlex 70 is a 4 kW VFD. It is a 8.7 A rated VFD. "
70119,20AC8P7A3AYNNEC0,"This Allen Bradley 5 horsepower PF70 is a 8.7 A VFD. Additionally, it comes with an Ethernet communcation (20-COMM-E) option installed. In addition, it is a 4 kW drive and is contained in a panel mount (IP20) enclosure. This PowerFlex 70 is powered with 400 VAC (50 Hz). It is a size B frame drive. "
70118,20AC8P7A3AYYACG0,"This Allen-Bradley 8.7 Amp PowerFlex 70 AC drive is a 5 horsepower rated drive. This PowerFlex 70 AC drive is housed in a panel mount (IP20) enclosure. Additionally, it is powered with 400 VAC (50 Hz). Also, this AC drive is a 4 kW unit. It has a B frame size. "
70107,20AC8P7A5AYNANNN,"The 20AC8P7A5AYNANNN by Allen-Bradley has a rating of 8.7 Amp. This AC drive comes with a standard control unit installed. This drive has a B frame size. Additionally, it has a rating of 4 kW and a horsepower rating of 5 HP. Also, this Allen-Bradley PowerFlex 70 is a 400 VAC (50 Hz) VFD. "
70117,20AC8P7C3AYNNNC0,"This Allen Bradley 8.7 A VFD is a 5 horsepower rated unit. Also, it has an enhanced control option board included, is housed in a wall/machine mount = IP66 enclosure, and a full numeric LCD inferface module included. It is a size B frame. It has power requirements of 400 VAC 3 phase. Additionally, it has a rating of 4 kW. "
70043,20AC8P7F3AYNNNC0,"This AB PF70 is a 4 kilowatt rated drive. This drive comes with a ND output rating of 5 HP. It needs 400 VAC (50 Hz) power to operate. Also, it comes with an output rating of 8.7 A and a B frame size. It comes with a LCD and numeric keypad on this drive. "
69960,20AD011A0ANYNANC0,"The 20AD011A0ANYNANC0 made by Allen Bradley comes with a rating of 7.5 horsepower. It is a 5.5 kilowatt VFD. In addition, it has a standard option board. It requires 480V AC power. Additionally, it has a rating of 11 Amp, is housed in an IP20 (panel mount) enclosure type, and a C frame size. "
69381,20AD011A0AYNACC0,"The 20AD011A0AYNACC0 built by Allen-Bradley/Rockwell Automation has an amperage output rating of 11 Amp. This drive also, comes with a HP ND output rating of 7.5 horsepower. It requires 480 VAC 3 phase and is a size C frame unit. This PowerFlex 70 AC drive comes with no keypad unit installed, instead this drive a blank cover. Additionally, this Allen-Bradley PowerFlex 70 AC drive is a 5.5 kilowatt drive. "
69380,20AD011A0AYNACCN,"The 20AD011A0AYNACCN by Allen Bradley has a rating of 11 A. In addition, this Allen-Bradley PF70 is a size C frame unit. Additionally, this Allen-Bradley PF70 has no keypad unit installed, instead this drive a blank cover. It has power requirements of 480 VAC 3 phase. This drive has a HP rating of 7.5 horsepower, is a 5.5 kilowatt VFD, and allows for communication with a ControlNet communication(20-COMM-C) unit installed. "
71561,20AD011A0AYNACG0,"The Allen-Bradley/Rockwell Automation 20AD011A0AYNACG0 adjustable frequency drive is a 11 Amp rated VFD. This PowerFlex 70 additionally, comes with a rating of 7.5 HP. It comes with a C frame size. This VFD comes with no keypad unit included, instead the drive a blank cover. In addition, it has a rating of 5.5 kW. "
69379,20AD011A0AYNACNN,"The Allen Bradley 20AD011A0AYNACNN adjustable frequency drive is a 7.5 horsepower drive. This PF70 is a 5.5 kilowatt drive. In addition, this Allen-Bradley VFD has an IP20 (panel mount) enclosure rating. Additionally, it has a rating of 11 A. This adjustable frequency drive is a 480 VAC 3 phase VFD, has a blank cover in place of the HIM module, and a standard control option included. "
69378,20AD011A0AYNADC0,"This AC drive manufactured by Allen-Bradley/Rockwell Automation is a 5.5 kW unit. Also, it has no keypad unit included, instead the drive a blank cover. This VFD comes with a HP rating of 7.5 HP. It is a 480 VAC 3 phase VFD and comes with a C frame size. This adjustable frequency drive has a rating of 11 A. "
69377,20AD011A0AYNADCN,"This adjustable frequency drive made by Allen-Bradley/Rockwell Automation is a 7.5 horsepower rated unit. In addition, it has power requirements of 480 VAC 3 phase, allows for communication by having a DeviceNet module included, and is a size C frame. This VFD additionally, is a 5.5 kW rated unit. It comes with a panel mount (IP20) enclosure type. It is a 11 Amp drive. "
69376,20AD011A0AYNADNN,"This Allen-Bradley PowerFlex 70 is a 11 A VFD. This drive also, has a standard control module included. This drive is a 480V AC VFD. It is contained in a panel mount - IP 20 enclosure. Additionally, it is a 5.5 kilowatt VFD and is a 7.5 horsepower drive. "
69941,20AD011A0AYNAEC0,"This Allen Bradley 7.5 horsepower VFD is a 5.5 kW drive. In addition, it is a size C frame drive. It is housed in an IP20 (panel mount) enclosure. It has power requirements of 480V AC. This AC drive has an output rating of 11 A and an EtherNet/IP option. "
69375,20AD011A0AYNAECN,"The 20AD011A0AYNAECN manufactured by Allen-Bradley/Rockwell Automation comes with a horsepower rating of 7.5 horsepower. Also, it has a kW ND output rating of 5.5 kW, no keypad unit, instead it a blank cover, and a C frame size. It is housed in a panel mount (IP20) enclosure. This PowerFlex 70 in addition, is a 11 A rated unit. This PF70 comes with an enhanced control unit installed. "
69792,20AD011A0AYNAEG0,"This Allen Bradley 11 A PowerFlex 70 AC drive is a 5.5 kilowatt rated unit. It comes with an EtherNet/IP unit. It is a 480 VAC 3 phase VFD. Additionally, it is a 7.5 HP drive. This PowerFlex 70 AC drive also, comes with a blank cover in place of the keypad/LCD module. "
69374,20AD011A0AYNAENN,"The 20AD011A0AYNAENN built by Allen Bradley comes with a ND output rating of 7.5 HP. This PowerFlex 70 comes with a standard board installed. This VFD allows for communication by having an Ethernet communcation (20-COMM-E) module and has power requirements of 480 VAC (50 Hz). Also, this AB drive comes with an amperage rating of 11 A. This VFD additionally, comes with a rating of 5.5 kilowatt. "
69146,20AD011A0AYNANC0,"This AC drive made by AB has a HP rating of 7.5 horsepower. This AC drive also, is a 11 A unit. It comes with no human interface included, instead it a blank cover. This PowerFlex 70 AC drive is a 5.5 kilowatt rated VFD, comes with an enhanced option board installed, and has power requirements of 480 VAC 3 phase. In addition, this PowerFlex 70 is a size C frame unit. "
69373,20AD011A0AYNANCN,"This AB 7.5 HP VFD comes with a kW ND output rating of 5.5 kW. It comes with a rating of 11 Amp and an enhanced control card on the drive. This VFD comes with no human interface included, instead it a blank cover. This adjustable frequency drive has an IP20 (panel mount) enclosure type. It requires 480 VAC (50 Hz) power. "
69441,20AD011A0AYNANG0,"This VFD built by Allen Bradley is a 7.5 horsepower unit. It utilizes 480V AC power to operate. It is a 5.5 kilowatt unit. It comes with a safe off option installed and no keypad unit installed, instead this drive a blank cover. Also, it comes with an output rating of 11 A. "
69940,20AD011A0AYNANNN,"This Allen-Bradley 11 A PF70 is a 7.5 horsepower rated drive. Additionally, this PowerFlex 70 has power requirements of 480 VAC 3 phase. In addition, this Allen-Bradley AC drive has a kW rating of 5.5 kilowatt. This AC drive has no keypad unit, instead the drive a blank cover. It has a standard control option. "
69939,20AD011A0AYNARNN,"This adjustable frequency drive made by Allen-Bradley comes with an output rating of 11 A. This AC drive also, comes with no HIM unit, instead this drive a blank cover. In addition, this AC drive comes with a rating of 5.5 kW and a rating of 7.5 horsepower. It is a size C frame drive. This drive allows for communication by having a RIO communication unit included. "
69938,20AD011A0AYNSNNN,"The Allen Bradley 20AD011A0AYNSNNN adjustable frequency drive is a 5.5 kilowatt VFD. It has a panel mount - IP 20 enclosure type rating. In addition, it has a ND output rating of 7.5 horsepower. This drive comes with a standard card included. Additionally, it is a 11 Amp VFD, has power requirements of 480 VAC (50 Hz), and comes with a blank cover in place of the keypad/LCD module. "
69638,20AD011A0AYYANC0,"This Allen-Bradley/Rockwell Automation 5.5 kW drive comes with an amperage rating of 11 Amp. This AC drive has a C frame size. This PF70 is a 480 VAC 3 phase variable frequency drive. In addition, it has a braking resistor and is contained in a panel mount (IP20) enclosure. Also, it is a 7.5 horsepower drive. "
69937,20AD011A0AYYANNN,"The Allen Bradley 20AD011A0AYYANNN drive is a 5.5 kW rated drive. This PowerFlex 70 AC drive additionally, is a 7.5 horsepower unit. It includes a brake Resistor. It has power requirements of 480 VAC 3 phase. In addition, this VFD is a 11 Amp rated AC drive. "
69372,20AD011A0NYNACC0,"This PowerFlex 70 built by Allen-Bradley/Rockwell Automation is a 7.5 HP unit. Also, it is a 5.5 kW unit. It comes with an enhanced unit included on the drive and a ControlNet (Coax) unit included. This AC drive requires 480 VAC (50 Hz) power to operate. In addition, it comes with an amperage output rating of 11 A. "
